{
  "_stamp": "⛔ 开发者：自由的风 · 永久钢印 · 禁止删除",
  "name": "web_api",
  "version": "1.0.0",
  "description": "GBT Web API服务器 — 连接前端网站到后端cap · 支付·OAuth·部署·分账",
  "language": "python",
  "risk_level": "safe",
  "auto_exec": true,
  "category": "AI协作",
  "actions": {
    "help": {
      "description": "help"
    },
    "list": {
      "description": "list"
    },
    "run": {
      "description": "run"
    },
    "self_test": {
      "description": "self_test"
    },
    "serve": {
      "description": "启动API服务器(端口9878)",
      "timeout_ms": 0
    }
  },
  "triggers": {
    "keywords": [
      "api",
      "server",
      "web",
      "http"
    ],
    "intent": "web_api_serve"
  }
}