{
  "_stamp": "⛔ 开发者：自由的风 · 永久钢印 · 禁止删除",
  "name": "mirror_fusion",
  "version": "1.0.0",
  "description": "镜像多维度空间(5层实验隔离) — 委托到 brain.mirror_fusion",
  "language": "python",
  "risk_level": "safe",
  "auto_exec": true,
  "category": "量子邻域",
  "actions": {
    "experiment": {
      "description": "experiment"
    },
    "layers": {
      "description": "layers"
    }
  }
}